{
  "$schema": "http://json-schema.org/draft-07/schema#",
  "title": "Adherence Log Attestation",
  "type": "object",
  "required": [
    "schema_version", "session", "artifact", "doctrine_sha",
    "rules_in_scope", "per_rule_status", "deviations",
    "bias_direction", "independent_reviewer_counterclaim", "verdict"
  ],
  "properties": {
    "schema_version": { "type": "string", "pattern": "^\\d+\\.\\d+$" },
    "session":   { "type": "string", "pattern": "^session_\\d{4}-\\d{2}-\\d{2}[a-z]?(-.*)?$" },
    "artifact":  { "type": "string", "pattern": "^(references/bpc-reasoning|references/connection-reasoning|decisions|sessions)/.+\\.md$" },
    "doctrine_sha": { "type": "string", "pattern": "^[a-f0-9]{7}$" },
    "rules_in_scope": {
      "type": "array", "minItems": 1,
      "items": { "type": "string", "pattern": "^[a-z][a-z0-9-]+$" },
      "description": "Stable rule identifiers per references/skill-registry.md, not rule numbers"
    },
    "per_rule_status": {
      "type": "object",
      "patternProperties": {
        "^[a-z][a-z0-9-]+$": {
          "type": "object", "required": ["status"],
          "properties": {
            "status":        { "enum": ["FIRED","NOT-FIRED","SKIPPED"] },
            "evidence_path": { "type": "string" },
            "reason":        { "type": "string", "minLength": 10 }
          },
          "allOf": [
            { "if": { "properties": { "status": { "const": "SKIPPED" } } },
              "then": { "required": ["reason"] } },
            { "if": { "properties": { "status": { "const": "FIRED" } } },
              "then": { "required": ["evidence_path"] } }
          ]
        }
      },
      "additionalProperties": false
    },
    "deviations": {
      "type": "array",
      "items": {
        "type": "object", "required": ["rule","reason"],
        "properties": {
          "rule":   { "type": "string", "pattern": "^[a-z][a-z0-9-]+$" },
          "reason": { "type": "string", "minLength": 20 }
        }
      }
    },
    "bias_direction":                    { "type": "string", "minLength": 30 },
    "independent_reviewer_counterclaim": { "type": "string", "minLength": 30 },
    "verdict": { "enum": ["CLEAN","DEVIATION-LOGGED","NON-COMPLIANT","REVERT"] },
    "reattestation": {
      "type": "array",
      "description": "Forward-only re-grounding log (DR-2026-07-21). Each entry records a re-attestation against a later doctrine state; the top-level doctrine_sha tracks the most recent grounding. Never rewrite a prior entry.",
      "items": {
        "type": "object",
        "required": ["prior_doctrine_sha", "delta_ref", "materiality", "reason"],
        "properties": {
          "prior_doctrine_sha": { "type": "string", "pattern": "^[a-f0-9]{7}$" },
          "new_doctrine_sha":   { "type": "string", "pattern": "^[a-f0-9]{7}$" },
          "delta_ref":          { "type": "string", "minLength": 3, "description": "Doctrine-state id or commit that defines the delta (see governance/doctrine-deltas.json)" },
          "materiality":        { "enum": ["MATERIAL", "IMMATERIAL"] },
          "verdict_change":     { "enum": ["none", "CLEAN", "DEVIATION-LOGGED", "NON-COMPLIANT", "REVERT"] },
          "reason":             { "type": "string", "minLength": 20 }
        },
        "additionalProperties": false
      }
    }
  },
  "additionalProperties": false
}
