{
  "schema_version": "1.0",
  "session": "session_2026-08-31-od-batch-ratification",
  "artifact": "decisions/DR-2026-08-31-co1-warrant-must-name-the-co-production.md",
  "doctrine_sha": "bd84be7",
  "rules_in_scope": [
    "integrity-protocol",
    "source-discipline",
    "adherence-logging-and-attestation"
  ],
  "per_rule_status": {
    "integrity-protocol": {
      "status": "FIRED",
      "evidence_path": "data/decisions/decision_register.yaml",
      "reason": "The canonical database is written only through the sanctioned path -- rows emitted with scripts/emit_data_migration.py and applied with scripts/migrate_db.py, verified on a scratch copy before canonical is touched. No hand-written SQL is executed against data/guidebook.db. The register row is the single home; this DR is GENERATED from it."
    },
    "source-discipline": {
      "status": "FIRED",
      "evidence_path": "decisions/DR-2026-08-31-co1-warrant-must-name-the-co-production.md",
      "reason": "This attestation covers a ruling whose ORIGINAL PREMISE I refuted by measurement before recording it. The 2026-08-22 plan asserted co1_provenance was NULL on all three Co-1 sources; it is not -- all three carry 'published_corpus'. The first ruling was therefore re-put to the owner rather than recorded as adopted, because as adopted it was a gate that examined nothing. The record also states the uncomfortable consequence: REF-00966 becomes unwarranted-pending under the new rule even though its co-production is real, so its RECORD needs correcting upward, not its tier downward."
    },
    "adherence-logging-and-attestation": {
      "status": "FIRED",
      "evidence_path": "attestations/decisions_DR-2026-08-31-co1-warrant-must-name-the-co-production.json",
      "reason": "This attestation covers D-0178 specifically -- one per DR, because the attestation_presence gate requires one per record and a single attestation covering a batch fails it. All seven rulings were put to the owner as DG-NON decisions under DR-2026-08-19 \u00a73 step 4a, which names this batch the owner's act and not a session's."
    }
  },
  "deviations": [],
  "bias_direction": "Toward recording the rulings as cleanly adopted. Resisted in two places: OD-D's premise was measured false and the question re-put to the owner rather than recorded as ruled, and OD-E was found already satisfied and recorded as such rather than performed. Both corrections make this batch look less complete than it would have otherwise.",
  "independent_reviewer_counterclaim": "That OD-C fixes an applicability set before synthesis has run, which D-0174 reserves to synthesis. Sustained in part, and recorded in D-0177's own notes rather than rebutted: the set is a research frame, not a determination, and the record forbids citing it as though synthesis produced it.",
  "verdict": "CLEAN"
}
